[
  {
    "id": "gastrocnemius",
    "meshes": ["Medial head of gastrocnemius.r", "Lateral head of gastrocnemius.r"],
    "attachmentMeshes": ["Med. head of gastrocnemius origin and insertion.r", "Lat. head of gastrocnemius origin and insertion.r"],
    "name": { "fi": "kaksoiskantalihas", "la": "Musculus gastrocnemius" },
    "origin": "Kaksi päätä: lateraalinen pää reisiluun ulommasta nivelnastasta, mediaalinen pää reisiluun sisemmästä nivelnastasta.",
    "insertion": "Yhtyy leveän kantalihaksen kanssa akillesjänteeksi (kantajänne), joka kiinnittyy kantaluuhun.",
    "action": "Nilkan ojennus (plantaarifleksio) ja polven koukistus.",
    "layer": "superficial",
    "sources": ["teachme-leg-posterior", "fipat-ta2"]
  },
  {
    "id": "soleus",
    "meshes": ["Soleus muscle.r"],
    "attachmentMeshes": ["Soleus origin and insertion.r"],
    "name": { "fi": "leveä kantalihas", "la": "Musculus soleus" },
    "origin": "Sääriluun leveän kantalihaksen linja (linea musculi solei) ja pohjeluun yläosa.",
    "insertion": "Yhtyy kaksoiskantalihaksen kanssa akillesjänteeksi (kantajänne), joka kiinnittyy kantaluuhun.",
    "action": "Nilkan ojennus (plantaarifleksio).",
    "layer": "superficial",
    "sources": ["teachme-leg-posterior", "fipat-ta2"]
  },
  {
    "id": "plantaris",
    "meshes": ["Plantaris muscle.r"],
    "attachmentMeshes": ["Plantaris origin and insertion.r"],
    "name": { "fi": "jalkapohjalihas", "la": "Musculus plantaris" },
    "origin": "Reisiluun ulomman nivelnastan yläpuolinen harjanne (linea supracondylaris lateralis).",
    "insertion": "Pitkä jänne kulkee kaksoiskantalihaksen ja leveän kantalihaksen välissä, yhtyy akillesjänteeseen ja kiinnittyy kantaluuhun.",
    "action": "Avustaa nilkan ojennuksessa (plantaarifleksio) ja polven koukistuksessa.",
    "layer": "superficial",
    "sources": ["teachme-leg-posterior", "fipat-ta2"]
  },
  {
    "id": "popliteus",
    "meshes": ["Popliteus muscle.r"],
    "attachmentMeshes": ["Popliteus origin and insertion.r"],
    "name": { "fi": "polvitaivelihas", "la": "Musculus popliteus" },
    "origin": "Reisiluun ulompi nivelnasta ja polvinivelen ulompi nivelkierukka.",
    "insertion": "Sääriluun yläosa, heti leveän kantalihaksen lähtökohdan yläpuolella.",
    "action": "Kiertää reisiluuta ulospäin suhteessa sääriluuhun.",
    "layer": "deep",
    "sources": ["teachme-leg-posterior", "fipat-ta2"]
  },
  {
    "id": "tibialis_posterior",
    "meshes": ["Tibialis posterior muscle.r"],
    "attachmentMeshes": ["Tibialis posterior origin and insertion.r"],
    "name": { "fi": "takimmainen säärilihas", "la": "Musculus tibialis posterior" },
    "origin": "Sääriluun ja pohjeluun takapinnat sekä niiden välinen kalvo (membrana interossea).",
    "insertion": "Jänne kulkee sisemmän kehräsluun takaa jalkaterään ja kiinnittyy sisempien nilkkaluiden jalkapohjan puoleisiin pintoihin.",
    "action": "Jalkaterän inversio ja nilkan ojennus (plantaarifleksio).",
    "layer": "deep",
    "sources": ["teachme-leg-posterior", "fipat-ta2"]
  },
  {
    "id": "flexor_digitorum_longus",
    "meshes": ["Flexor digitorum longus.r"],
    "attachmentMeshes": ["Flexor digitorum longus origin and insertion.r"],
    "name": { "fi": "varpaiden pitkä koukistajalihas", "la": "Musculus flexor digitorum longus" },
    "origin": "Sääriluun takapinta.",
    "insertion": "Neljän ulomman varpaan jalkapohjan puoleiset pinnat.",
    "action": "Neljän ulomman varpaan koukistus.",
    "layer": "deep",
    "sources": ["teachme-leg-posterior", "fipat-ta2"]
  },
  {
    "id": "flexor_hallucis_longus",
    "meshes": ["Flexor hallucis longus.r"],
    "attachmentMeshes": ["Flexor hallucis longus origin and insertion.r"],
    "name": { "fi": "isonvarpaan pitkä koukistajalihas", "la": "Musculus flexor hallucis longus" },
    "origin": "Pohjeluun takapinta.",
    "insertion": "Isonvarpaan varvasluun jalkapohjan puoleinen pinta.",
    "action": "Isonvarpaan koukistus.",
    "layer": "deep",
    "sources": ["teachme-leg-posterior", "fipat-ta2"]
  },
  {
    "id": "tibialis_anterior",
    "meshes": ["Tibialis anterior muscle.r"],
    "attachmentMeshes": ["Tibialis anterior origin and insertion.r"],
    "name": { "fi": "etummainen säärilihas", "la": "Musculus tibialis anterior" },
    "origin": "Sääriluun lateraalinen pinta.",
    "insertion": "Sisempi vaajaluu ja ensimmäisen jalkapöytäluun tyvi.",
    "action": "Nilkan koukistus (dorsifleksio) ja jalkaterän inversio.",
    "layer": "superficial",
    "sources": ["teachme-leg-anterior", "fipat-ta2"]
  },
  {
    "id": "extensor_digitorum_longus",
    "meshes": ["Extensor digitorum longus.r", "Extensor digitorum longus tendons.r"],
    "attachmentMeshes": ["Extensor digitorum longus origin and insertion.r"],
    "name": { "fi": "varpaiden pitkä ojentajalihas", "la": "Musculus extensor digitorum longus" },
    "origin": "Sääriluun ulompi nivelnasta ja pohjeluun mediaalinen pinta.",
    "insertion": "Jänne jakautuu neljäksi, ja kukin jänne kiinnittyy yhteen neljästä ulommasta varpaasta.",
    "action": "Neljän ulomman varpaan ojennus ja nilkan koukistus (dorsifleksio).",
    "layer": "superficial",
    "sources": ["teachme-leg-anterior", "fipat-ta2"]
  },
  {
    "id": "extensor_hallucis_longus",
    "meshes": ["Extensor hallucis longus.r"],
    "attachmentMeshes": ["Extensor hallucis longus brevis origin and insertion.r"],
    "name": { "fi": "isonvarpaan pitkä ojentajalihas", "la": "Musculus extensor hallucis longus" },
    "origin": "Pohjeluun varren mediaalinen pinta.",
    "insertion": "Jänne kulkee nilkkanivelen edestä ja kiinnittyy isonvarpaan kärkijäsenen tyveen.",
    "action": "Isonvarpaan ojennus ja nilkan koukistus (dorsifleksio).",
    "layer": "deep",
    "sources": ["teachme-leg-anterior", "fipat-ta2"]
  },
  {
    "id": "fibularis_tertius",
    "meshes": ["Fibularis tertius muscle.r"],
    "attachmentMeshes": ["Fibularis tertius origin and insertion.r"],
    "name": { "fi": "kolmas pohjeluulihas", "la": "Musculus fibularis tertius" },
    "origin": "Pohjeluun mediaalinen pinta yhdessä varpaiden pitkän ojentajalihaksen kanssa.",
    "insertion": "Jänne laskeutuu jalkaterän selkäpuolelle ja kiinnittyy viidenteen jalkapöytäluuhun.",
    "action": "Jalkaterän eversio ja nilkan koukistus (dorsifleksio).",
    "layer": "superficial",
    "sources": ["teachme-leg-anterior", "fipat-ta2"]
  },
  {
    "id": "fibularis_longus",
    "meshes": ["Fibularis longus muscle.r"],
    "attachmentMeshes": ["Fibularis longus origin and insertion.r"],
    "name": { "fi": "pitkä pohjeluulihas", "la": "Musculus fibularis longus" },
    "origin": "Pohjeluun yläosa ja lateraalinen puoli.",
    "insertion": "Jalkaterän sisäreunan luut: sisempi vaajaluu ja ensimmäisen jalkapöytäluun tyvi.",
    "action": "Jalkaterän eversio ja nilkan ojennus (plantaarifleksio). Tukee myös jalkaterän ulompaa pitkittäistä holvia ja poikittaista holvia.",
    "layer": "superficial",
    "sources": ["teachme-leg-lateral", "fipat-ta2"]
  },
  {
    "id": "fibularis_brevis",
    "meshes": ["Fibularis brevis muscle.r"],
    "attachmentMeshes": ["Fibularis brevis origin and insertion.r"],
    "name": { "fi": "lyhyt pohjeluulihas", "la": "Musculus fibularis brevis" },
    "origin": "Pohjeluun varren alaosan lateraalinen pinta.",
    "insertion": "Viidennen jalkapöytäluun kyhmy.",
    "action": "Jalkaterän eversio.",
    "layer": "deep",
    "sources": ["teachme-leg-lateral", "fipat-ta2"]
  },
  {
    "id": "extensor_digitorum_brevis",
    "meshes": ["Extensor digitorum brevis.r"],
    "attachmentMeshes": ["Extensor digitorum brevis origin and insertion.r"],
    "name": { "fi": "varpaiden lyhyt ojentajalihas", "la": "Musculus extensor digitorum brevis" },
    "origin": "Kantaluu ja alempi ojentajien pidinside (retinaculum musculorum extensorum inferius).",
    "insertion": "Toisen–neljännen varpaan pitkät ojentajajänteet.",
    "action": "Varpaiden ojennus.",
    "layer": "superficial",
    "sources": ["teachme-foot", "fipat-ta2"]
  },
  {
    "id": "extensor_hallucis_brevis",
    "meshes": ["Extensor hallucis brevis.r"],
    "attachmentMeshes": ["Extensor hallucis brevis brevis origin and insertion.r"],
    "name": { "fi": "isonvarpaan lyhyt ojentajalihas", "la": "Musculus extensor hallucis brevis" },
    "origin": "Kantaluu ja alempi ojentajien pidinside (retinaculum musculorum extensorum inferius).",
    "insertion": "Isonvarpaan tyvijäsenen tyvi.",
    "action": "Isonvarpaan ojennus.",
    "layer": "superficial",
    "sources": ["teachme-foot", "fipat-ta2"]
  },
  {
    "id": "abductor_hallucis",
    "meshes": ["Abductor hallucis.r"],
    "attachmentMeshes": ["Abductor hallucis origin and insertion.r"],
    "name": { "fi": "isonvarpaan loitontajalihas", "la": "Musculus abductor hallucis" },
    "origin": "Kantaluun mediaalinen kyhmy, koukistajien pidinside ja jalkapohjan kalvojänne (plantaarifaskia).",
    "insertion": "Isonvarpaan tyvijäsenen tyven mediaalinen puoli.",
    "action": "Isonvarpaan loitonnus ja koukistus.",
    "layer": "superficial",
    "sources": ["teachme-foot", "fipat-ta2"]
  },
  {
    "id": "flexor_digitorum_brevis",
    "meshes": ["Flexor digitorum brevis.r"],
    "attachmentMeshes": ["Flexor digitorum brevis origin and insertion.r"],
    "name": { "fi": "varpaiden lyhyt koukistajalihas", "la": "Musculus flexor digitorum brevis" },
    "origin": "Kantaluun mediaalinen kyhmy ja jalkapohjan kalvojänne (plantaarifaskia).",
    "insertion": "Neljän ulomman varpaan keskijäsenet.",
    "action": "Neljän ulomman varpaan koukistus keskinivelistä (proksimaaliset interfalangeaalinivelet).",
    "layer": "superficial",
    "sources": ["teachme-foot", "fipat-ta2"]
  },
  {
    "id": "abductor_digiti_minimi_pedis",
    "meshes": ["Abductor digiti minimi of foot.r"],
    "attachmentMeshes": ["Abductor digiti minimi of foot origin and insertion.r"],
    "name": { "fi": "pikkuvarpaan loitontajalihas", "la": "Musculus abductor digiti minimi pedis" },